Question ID,Subject Category,Content Category,Concept Category (CC),Question,Correct,Wrong 1,Wrong 2,Wrong 3,Keywords?,,,
B1AA-001,Biochemistry,1A,Amino Acids,"Which amino acid is represented by the following structure? 

<img src=""Glycine.png"">",Glycine,Glutamine,Valine,Serine,,,,
B1AA-002,Biochemistry,1A,Amino Acids,Which amino acid is represented by the molecular structure shown in the image?,Alanine,Glycine,Valine,Leucine,,,,
B1AA-003,Biochemistry,1A,Amino Acids,"Which amino acid is represented by the following molecular structure? 

![Valine.png](attachment:Valine.png)",Valine,Leucine,Isoleucine,Threonine,,,,
B1AA-004,Biochemistry,1A,Amino Acids,Which of the following amino acids is depicted in the image provided?,Leucine,Valine,Isoleucine,Phenylalanine,,,,
B1AA-005,Biochemistry,1A,Amino Acids,Which amino acid is represented by the molecular structure shown in the image?,Isoleucine,Leucine,Valine,Methionine,,,,
B1AA-006,Biochemistry,1A,Amino Acids,Which amino acid is represented by the structure shown in the image?,Tryptophan,Tyrosine,Threonine,Glutamine,,,,
B1AA-007,Biochemistry,1A,Amino Acids,"Which amino acid is depicted in the following structure?

![Serine](Serine.png)",Serine,Threonine,Glycine,Alanine,,,,
B1AA-008,Biochemistry,1A,Amino Acids,"Which amino acid, having the structure depicted in the image below, contains a hydroxyl group in its side chain and is classified as polar and uncharged?",Threonine,Serine,Valine,Leucine,,,,
B1AA-009,Biochemistry,1A,Amino Acids,"A biochemistry concept related to enzyme function and protein structure can be tied into a question for the MCAT using the provided flashcard. Here's a relevant question:

""In the context of protein structure and enzymatic function, identify the amino acid shown in the structural image and describe its significance in protein phosphorylation and signal transduction pathways.""",Tyrosine,Tryptophan,Phenylalanine,Serine,,,,
B1AA-010,Biochemistry,1A,Amino Acids,Which amino acid is depicted in the image provided?,Cysteine,Methionine,Threonine,Serine,,,,
B1AA-011,Biochemistry,1A,Amino Acids,"Based on the structure shown in the attached image, identify the amino acid.",Asparagine,Glutamine,Serine,Threonine,,,,
B1AA-012,Biochemistry,1A,Amino Acids,Which amino acid is depicted in the image provided?,Glutamine,Glycine,Serine,Alanine,,,,
B1AA-013,Biochemistry,1A,Amino Acids,Which amino acid is depicted in the image provided?,Lysine,Leucine,Alanine,Valine,,,,
B1AA-014,Biochemistry,1A,Amino Acids,"Which amino acid is depicted in the following image?

![Arginine](Arginine.png)",Arginine,Lysine,Histidine,Glutamine,,,,
B1AA-015,Biochemistry,1A,Amino Acids,Which amino acid is depicted in the structure shown in the image?,Histidine,Lysine,Glycine,Serine,,,,
B1AA-016,Biochemistry,1A,Amino Acids,Which amino acid is represented by the structure shown in the image?,Aspartate,Glutamate,Serine,Glycine,,,,
B1AA-017,Biochemistry,1A,Amino Acids,"Which amino acid is depicted in the image provided, characterized by having a carboxylate side chain and playing a crucial role in neurotransmission and metabolism?",Glutamate,Aspartate,Lysine,Serine,,,,
B1AA-018,Biochemistry,1A,Amino Acids,Which functional group is depicted in the image provided?,indole,benzene,pyrrole,furan,,,,
B1AA-019,Biochemistry,1A,Amino Acids,"Which functional group is shown in the following image? 

![Imidazole](Imidazole.png)",imidazole,benzene,pyridine,thiophene,,,,
B1AA-020,Biochemistry,1A,Amino Acids,"Which functional group is depicted in the image provided? 

<img src=""Guanidinium.png"">

A) Ammonium  
B) Guanidinium  
C) Carboxyl  
D) Hydroxyl",guanidinium,guanine,guanidine,urea,,,,
B1AA-021,Biochemistry,1A,Amino Acids,"Which functional groups are present in amino acids, making them simple organic compounds?",carboxyl (—COOH),hydroxyl (—OH),phosphate (—PO₄),sulfhydryl (—SH),,,,
B1AA-022,Biochemistry,1A,Amino Acids,Which of the following amino acids is unique in that it is not chiral?,Glycine,Alanine,Valine,Leucine,,,,
B1AA-023,Biochemistry,1A,Amino Acids,"Which form of stereochemistry is found at the α-carbon of all eukaryotic amino acids, with the exception of glycine?",L,D,R,S,,,,
B1AA-024,Biochemistry,1A,Amino Acids,Which chiral amino acid is the exception to the rule that all chiral amino acids have the (S) configuration?,(S),(R),(D),(L),,,,
B1AA-025,Biochemistry,1A,Amino Acids,Which of the following correctly distinguishes between the types of stereoisomer configurations where one set indicates relative configuration and the other set indicates absolute configuration?,relative,absolute,relative,absolute,,,,
B1AA-026,Biochemistry,1A,Amino Acids,What is the term used to describe the pH at which half of the species is deprotonated?,pK<sub>a</sub>,pH,buffer point,equivalence point,,,,
B1AA-027,Biochemistry,1A,Amino Acids,At what pH level will amino acids be fully protonated?,full protonated,partially deprotonated,fully deprotonated,partially protonated,,,,
B1AA-028,Biochemistry,1A,Amino Acids,Which of the following terms refers to the pH at which an amino acid exists in its zwitterion form?,Isoelectric point,Equivalence point,Buffer point,End point,,,,
B1AA-029,Biochemistry,1A,Amino Acids,Which term describes a molecule that is neutral due to all of its charges canceling out?,zwitterion,ion,cation,anion,,,,
B1AA-030,Biochemistry,1A,Amino Acids,What is the isoelectric point (pI) formula for an amino acid that does not have a side chain?,\(\frac{pK1 + pK2}{2}\),\(\frac{pK1 + pK3}{2}\),\(\frac{pK2 + pK3}{2}\),\(\frac{pK1 - pK2}{2}\),,,,
B1AA-031,Biochemistry,1A,Amino Acids,"For a peptide with a neutral side chain, which formula would you use to calculate the isoelectric point (pI)?",\(\frac{pK_1 + pK_2}{2}\),\(\frac{pK_1 - pK_2}{2}\),\(pK_1 + pK_2\),\(\frac{pK_1 \cdot pK_2}{2}\),,,,
B1AA-032,Biochemistry,1A,Amino Acids,Which of the following represents the correct formula for calculating the isoelectric point (pI) of an amino acid with a basic side chain?,\(\frac{{pK_a + pK_b}}{2}\),\(\frac{{pK_2 + pK_3}}{2}\),\(\frac{{pK_1 + pK_2}}{2}\),\(\frac{{pK_3 + pK_a}}{2}\),,,,
B1AA-033,Biochemistry,1A,Amino Acids,Which of the following formulas correctly represents the isoelectric point (pI) for an amino acid with an acidic side chain?,\(\frac{pK_a1 + pK_R}{2}\),\(\frac{pK_a1 + pK_a2}{2}\),\(\frac{pK_a2 + pK_R}{2}\),\(\frac{pK_a1 + pK_b}{2}\),,,,
B1AA-034,Biochemistry,1A,Amino Acids,"At the midpoint of a titration of a weak acid with a strong base, what is the relationship between the pH of the solution and the acid dissociation constant (Ka) of the weak acid?",pK<sub>a</sub>,0,7,14,,,,
B1AA-035,Biochemistry,1A,Amino Acids,"At the equivalence point of a titration involving a weak acid and a strong base, how is the pH of the solution typically related to the isoelectric point (pI) of the acid?",pI,pKa,pKb,pKw,,,,
B1AP-001,Biochemistry,1A,Proteins,Which level of protein structure refers to the linear sequence of amino acids in a peptide?,1°,2°,3°,4°,,,,
B1AP-002,Biochemistry,1A,Proteins,"Which level of protein structure is characterized by the local folding of neighboring amino acids, including α-helices and β-pleated sheets?",2°,1°,3°,4°,,,,
B1AP-003,Biochemistry,1A,Proteins,Which level of protein structure is characterized by the 3-D shape of a single polypeptide chain?,3°,1°,2°,4°,,,,
B1AP-004,Biochemistry,1A,Proteins,"Which level of protein structure involves the interaction between multiple peptide subunits, such as in proteins with more than one polypeptide chain?",4°,1°,2°,3°,,,,
B1AP-005,Biochemistry,1A,Proteins,Which secondary protein structure is characterized by clockwise coils around a central axis?,α-helices,3°,1°,4°,,,,
B1AP-006,Biochemistry,1A,Proteins,Which type of secondary protein structure is characterized by rippled strands that can be parallel or antiparallel?,β-pleated sheets,1°,3°,4°,,,,
B1AP-007,Biochemistry,1A,Proteins,"Which amino acid, known for its rigid cyclic structure, can interrupt secondary protein structure?",Proline,Glycine,Alanine,Serine,,,,
B1AP-008,Biochemistry,1A,Proteins,Which structural levels are disrupted when a protein undergoes {{c1::denaturation}} due to the breaking of non-covalent interactions?,Denaturation,Aggregation,Hydrolysis,Synthesis,,,,
B1AP-009,Biochemistry,1A,Proteins,"Which of the following statements about the hydrophobic effect and protein structure is true?

A. The hydrophobic effect drives hydrophobic R groups towards the interior of a protein and increases the entropy of the surrounding water molecules.
B. The hydrophobic effect drives hydrophobic R groups towards the exterior of a protein and increases the entropy of the surrounding water molecules.
C. The hydrophobic effect drives hydrophobic R groups towards the interior of a protein and decreases the entropy of the surrounding water molecules.
D. The hydrophobic effect drives hydrophobic R groups towards the exterior of a protein and decreases the entropy of the surrounding water molecules.",hydrophobic effect,hydrophilic effect,ionic bonding,hydrogen bonding,,,,
B1AP-010,Biochemistry,1A,Proteins,"Which type of bond is formed when two cysteine molecules are oxidized, resulting in a covalent bond between their thiol groups?",Disulfide bonds,Peptide bonds,Hydrogen bonds,Ionic bonds,,,,
B1AP-011,Biochemistry,1A,Proteins,Which type of protein consists of amino acids combined with other substances and includes examples such as hemoglobin?,Conjugated proteins,Simple proteins,Derived proteins,Fibrous proteins,,,,
B1AP-012,Biochemistry,1A,Proteins,"Which of the following terms describes an attached molecule in a conjugated protein that can be a metal ion, vitamin, lipid, carbohydrate, or nucleic acid?",prosthetic group,metal ion,vitamin,nucleic acid,,,,
B1AP-013,Biochemistry,1A,Proteins,Which functional groups are linked together by peptide bonds to form the primary structure of proteins?,α-carboxyl group,β-carboxyl group,α-hydroxyl group,β-hydroxyl group,,,,
B1AE-001,Biochemistry,1A,Enzymes,Which type of enzyme catalyzes redox reactions involving the transfer of electrons?,oxidoreductase,hydrolase,ligase,isomerase,,,,
B1AE-002,Biochemistry,1A,Enzymes,Which type of enzyme is responsible for moving a functional group from one molecule to another?,transferase,kinase,hydrolase,ligase,,,,
B1AE-003,Biochemistry,1A,Enzymes,Which type of enzyme catalyzes cleavage with the addition of H₂O?,hydrolase,lyase,ligase,oxidoreductase,,,,
B1AE-004,Biochemistry,1A,Enzymes,Which type of enzyme catalyzes the cleavage of a molecule without the addition of water or the transfer of electrons?,lyase,hydrolase,oxidoreductase,transferase,,,,
B1AE-005,Biochemistry,1A,Enzymes,Which type of enzyme catalyzes the interconversion of isomers?,isomerase,ligase,hydrolase,oxidoreductase,,,,
B1AE-006,Biochemistry,1A,Enzymes,"Which type of enzyme is primarily responsible for joining two large biomolecules, often of the same type, in biochemical processes?",ligase,lyase,isomerase,transferase,,,,
B1AE-007,Biochemistry,1A,Enzymes,Which type of enzyme catalyzes the hydrolysis of fats?,lipase,amylase,protease,cellulase,,,,
B1AE-008,Biochemistry,1A,Enzymes,Which type of enzyme is responsible for adding a phosphate group from ATP to a substrate?,kinase,phosphatase,lyase,isomerase,,,,
B1AE-009,Biochemistry,1A,Enzymes,Which type of enzyme is responsible for removing a phosphate group from a molecule?,phosphatase,kinase,ligase,polymerase,,,,
B1AE-010,Biochemistry,1A,Enzymes,"Which type of enzyme is responsible for adding a phosphate group from an inorganic phosphate, such as HPO₄, to a substrate?",phosphorylase,phosphatase,kinase,hydrolase,,,,
B1AE-011,Biochemistry,1A,Enzymes,Which part of an enzyme is responsible for the site of catalysis?,active site,substrate,inhibitor,product,,,,
B1AE-012,Biochemistry,1A,Enzymes,Which enzyme-substrate interaction theory posits that the enzyme and substrate are exactly complementary and fit together like a key into a lock?,lock and key theory,induced fit theory,transition state theory,conformational change theory,,,,
B1AE-013,Biochemistry,1A,Enzymes,"According to the {{c1::induced fit theory::... theory}}, what process do enzymes and substrates undergo to facilitate their interaction?",induced fit theory,lock and key theory,transition state theory,Michaelis-Menten theory,,,,
B1AE-014,Biochemistry,1A,Enzymes,Which of the following best describes a substance that is a metal cation and required by some enzymes for their activity?,cofactor,enzyme,coenzyme,substrate,,,,
B1AE-015,Biochemistry,1A,Enzymes,Which of the following best describes an organic molecule that is necessary for the functionality of certain enzymes?,cofactor or coenzyme,ion,metal,substrate,,,,
B1AE-016,Biochemistry,1A,Enzymes,Which type of enzyme inhibition occurs when an enzyme is inhibited by high levels of a product from later in the same metabolic pathway?,Feedback inhibition,Competitive inhibition,Non-competitive inhibition,Allosteric inhibition,,,,
B1AE-017,Biochemistry,1A,Enzymes,Which type of enzyme inhibitor binds at the active site and prevents the substrate from binding?,competitive inhibitor,allosteric inhibitor,non-competitive inhibitor,uncompetitive inhibitor,,,,
B1AE-018,Biochemistry,1A,Enzymes,Which type of inhibitor binds exclusively to the enzyme-substrate complex?,uncompetitive inhibitor,competitive inhibitor,non-competitive inhibitor,allosteric inhibitor,,,,
B1AE-019,Biochemistry,1A,Enzymes,Which type of enzyme inhibitor binds at an allosteric site away from the active site?,noncompetitive inhibitor,competitive inhibitor,uncompetitive inhibitor,reversible inhibitor,,,,
B1AE-020,Biochemistry,1A,Enzymes,Which of the following statements accurately describes the effects of competitive inhibition on enzyme kinetics?,has no change,decreases,increases,stays the same,,,,
B1AE-021,Biochemistry,1A,Enzymes,"In the context of enzyme kinetics, how does uncompetitive inhibition affect the V_max and K_m of an enzyme-catalyzed reaction?",goes down,stays the same,goes up,stays the same,,,,
B1AE-022,Biochemistry,1A,Enzymes,"How does noncompetitive inhibition affect the V_max and K_m of an enzyme-catalyzed reaction, and what are the implications for the enzyme's kinetic parameters?",goes down,increases,decreases,remains constant,,,,
B1AE-023,Biochemistry,1A,Enzymes,Which of the following alterations to an enzyme-catalyzed reaction would result in a Lineweaver-Burk plot with a steeper slope but the same X-intercept?,-1/Km,1/Vmax,Km/Vmax,Vmax/Km,,,,
B1AE-024,Biochemistry,1A,Enzymes,"Which type of enzyme inhibition is depicted in the Lineweaver-Burk plot, characterized by an increase in the apparent Michaelis constant (Km) without affecting the maximum reaction velocity (Vmax)?",competitive inhibitor,non-competitive inhibitor,uncompetitive inhibitor,mixed inhibitor,,,,
B1AE-025,Biochemistry,1A,Enzymes,"Which type of enzyme inhibition is characterized by a Lineweaver-Burk plot that shows parallel lines for different concentrations of inhibitor, indicating that both \( V_{max} \) and \( K_m \) decrease?",uncompetitive inhibitor,competitive inhibitor,non-competitive inhibitor,mixed inhibitor,,,,
B1AE-026,Biochemistry,1A,Enzymes,"Which type of enzyme inhibition can be identified by analyzing the provided Lineweaver-Burk plot, characterized by a constant Vmax and an increased apparent Km?",noncompetitive inhibitor,competitive inhibitor,uncompetitive inhibitor,mixed inhibitor,,,,
B1AE-027,Biochemistry,1A,Enzymes,"Which of the following statements correctly describes the intercepts on a Lineweaver-Burk plot, and how do these intercepts relate to enzyme kinetics parameters?",1/V<sub>max</sub>,-1/V<sub>max</sub>,1/K<sub>m</sub>,1/V<sub>min</sub>,,,,
B1AE-028,Biochemistry,1A,Enzymes,"Which of the following best describes an irreversible inhibitor in the context of enzyme activity? 

A) An inhibitor that non-covalently binds to the allosteric site of an enzyme, temporarily reducing its activity
B) An inhibitor that covalently binds to the active site of an enzyme, permanently eliminating its activity
C) An inhibitor that non-covalently binds to the active site of an enzyme, permanently eliminating its activity
D) An inhibitor that covalently binds to the allosteric site of an enzyme, temporarily reducing its activity",covalently binds,reversibly binds,competes with the substrate,undergoes conformational change,,,,
B1AE-029,Biochemistry,1A,Enzymes,Which type of enzyme inhibition is characterized by the formation of an irreversible complex when an enzyme binds a substrate analog?,Suicide inhibition,Competitive inhibition,Noncompetitive inhibition,Uncompetitive inhibition,,,,
B1AE-030,Biochemistry,1A,Enzymes,"Which type of effector binds at the allosteric site and induces a change in the conformation of the enzyme, preventing the substrate from binding to the active site?",allosteric effector,competitive inhibitor,cofactor,substrate,,,,
B1AE-031,Biochemistry,1A,Enzymes,Which type of allosteric regulator is also the substrate for the enzyme it regulates?,homotropic effector,heterotropic effector,negative effector,positive effector,,,,
B1AE-032,Biochemistry,1A,Enzymes,Which of the following best describes a heterotropic effector in the context of enzyme regulation?,heterotropic effector,homotropic effector,orthotropic effector,isotropic effector,,,,
B1AE-033,Biochemistry,1A,Enzymes,Which of the following biochemical processes involves the chemical addition of a phosphoryl group (PO₃⁻) to an organic molecule?,Phosphorylation,Hydroxylation,Carboxylation,Methylation,,,,
B1AE-034,Biochemistry,1A,Enzymes,"Which biochemical process involves the chemical addition of a carbohydrate moiety to a molecule, often playing a critical role in protein folding, stability, and cell-cell interactions?",Glycosylation,Phosphorylation,Acetylation,Methylation,,,,
B1AE-035,Biochemistry,1A,Enzymes,What term describes the inactive precursors of enzymes that require a biochemical change to become active?,Zymogens,Coenzymes,Metabolites,Cofactors,,,,
B1AE-036,Biochemistry,1A,Enzymes,"Which of the following statements correctly describes the Michaelis-Menten reaction scheme depicted in the image, with respect to the formation and breakdown of the enzyme-substrate complex?","{{c1::<img src=""Michaelis Menten Reaction Scheme.jpg"">}}","{{c1::<img src=""Michaelis Menten Reaction Scheme 2.jpg"">}}","{{c1::<img src=""Enzyme Reaction Scheme.jpg"">}}","{{c1::<img src=""Catalytic Reaction Scheme.jpg"">}}",,,,
B1AE-037,Biochemistry,1A,Enzymes,"Which types of proteins are primarily responsible for composing the cytoskeleton, anchoring proteins, and much of the extracellular matrix?",Structural proteins,Transport proteins,Regulatory proteins,Enzymatic proteins,,,,
B1AP-014,Biochemistry,1A,Proteins,"Which of the following best describes the primary function of motor proteins?

A) Synthesis of DNA
B) Conversion of mechanical work into chemical energy
C) Conversion of chemical energy into mechanical work through ATP hydrolysis
D) Regulation of gene expression",mechanical work,electrical signals,thermal energy,light,,,,
B1AP-015,Biochemistry,1A,Proteins,Which type of protein acts as an agent to bind two or more molecules together?,binding protein,structural protein,enzymatic protein,regulatory protein,,,,
B1AP-016,Biochemistry,1A,Proteins,Which class of molecules is primarily responsible for enabling cells to bind to other cells or surfaces?,Cell Adhesion Molecules,Cell Migration Molecules,Cell Signaling Molecules,Cell Division Molecules,,,,
B1AP-017,Biochemistry,1A,Proteins,Which type of calcium-dependent glycoproteins are responsible for holding similar cells together?,Cadherins,Integrins,Selectins,Fibronectins,,,,
B1AP-018,Biochemistry,1A,Proteins,Which type of proteins have two membrane-spanning chains and permit cells to adhere to proteins in the extracellular matrix?,Integrins,Cadherins,Selectins,Immunoglobulins,,,,
B1AP-019,Biochemistry,1A,Proteins,Which type of proteins allow cells to adhere to carbohydrates on the surfaces of other cells and are most commonly used in the immune system?,Selectins,Cadherins,Integrins,Immunoglobulins,,,,
B1AP-020,Biochemistry,1A,Proteins,"Which type of protein is utilized by the immune system to specifically target and bind to an antigen, which may be a protein located on the surface of a pathogen or a toxin?",antibodies,white blood cells,T-cells,macrophages,,,,
B1AA-036,Biochemistry,1A,Amino Acids,Which of the following correctly describes the state of amino acids when exposed to a high pH environment?,fully deprotonated,partially protonated,neutral,fully protonated,,,,
B1AA-037,Biochemistry,1A,Amino Acids,"If the pH of an amino acid solution is equal to its isoelectric point (pI), what form does the amino acid predominantly take?",zwitterion,cation,anion,salt,,,,
B1AA-038,Biochemistry,1A,Amino Acids,"Which direction is the amino acid sequence of a peptide chain written in biochemical notation, starting from which terminus and ending at which terminus?",N-terminus to C-terminus,C-terminus to N-terminus,middle to C-terminus,middle to N-terminus,,,,
B1AP-021,Biochemistry,1A,Proteins,"In the context of peptide chains, what is the typical charge of the N-terminus?",positively,negatively,,,,,,
B1AP-022,Biochemistry,1A,Proteins,Which type of chemical bond is primarily responsible for stabilizing the primary (1°) structure of proteins?,peptide bonds,hydrogen bonds,ionic bonds,disulfide bonds,,,,
B1AP-023,Biochemistry,1A,Proteins,Which type of intramolecular interaction stabilizes the secondary structure of proteins?,hydrogen bonds,ionic bonds,covalent bonds,disulfide bridges,,,,
,Behavioral,6A,Biology and Behavior,,,,,,,,,
,Behavioral,6A,Biology and Behavior,,,,,,,,,
,Behavioral,6A,Biology and Behavior,,,,,,,,,
,Behavioral,6A,Biology and Behavior,,,,,,,,,
,Behavioral,6A,Biology and Behavior,,,,,,,,,
,Behavioral,6A,Biology and Behavior,,,,,,,,,
,Behavioral,6A,Biology and Behavior,,,,,,,,,
,Behavioral,6A,Biology and Behavior,,,,,,,,,
,Behavioral,6A,Biology and Behavior,,,,,,,,,
,Behavioral,6A,Biology and Behavior,,,,,,,,,
,Behavioral,6A,Biology and Behavior,,,,,,,,,
,Behavioral,6A,Biology and Behavior,,,,,,,,,
,Behavioral,6A,Biology and Behavior,,,,,,,,,
,Behavioral,6A,Biology and Behavior,,,,,,,,,
,Behavioral,6A,Biology and Behavior,,,,,,,,,
,Behavioral,6A,Biology and Behavior,,,,,,,,,
,Behavioral,6A,Biology and Behavior,,,,,,,,,
,Behavioral,6A,Biology and Behavior,,,,,,,,,
,Behavioral,6A,Biology and Behavior,,,,,,,,,
,Behavioral,6A,Biology and Behavior,,,,,,,,,
,Behavioral,6A,Biology and Behavior,,,,,,,,,
,Behavioral,6A,Biology and Behavior,,,,,,,,,
,Behavioral,6A,Biology and Behavior,,,,,,,,,
,Behavioral,6A,Biology and Behavior,,,,,,,,,
,Behavioral,6A,Biology and Behavior,,,,,,,,,
,Behavioral,6A,Biology and Behavior,,,,,,,,,
,Behavioral,6A,Biology and Behavior,,,,,,,,,
,Behavioral,6A,Biology and Behavior,,,,,,,,,
,Behavioral,6A,Biology and Behavior,,,,,,,,,
,Behavioral,6A,Biology and Behavior,,,,,,,,,
,Behavioral,6A,Biology and Behavior,,,,,,,,,
,Behavioral,6A,Biology and Behavior,,,,,,,,,
,Behavioral,6A,Biology and Behavior,,,,,,,,,
,Behavioral,6A,Biology and Behavior,,,,,,,,,
,Behavioral,6A,Biology and Behavior,,,,,,,,,
,Behavioral,6A,Biology and Behavior,,,,,,,,,
,Behavioral,6A,Biology and Behavior,,,,,,,,,
,Behavioral,6A,Sensation,,,,,,,,,
,Behavioral,6A,Sensation,,,,,,,,,
,Behavioral,6A,Sensation,,,,,,,,,
,Behavioral,6A,Sensation,,,,,,,,,
,Behavioral,6A,Sensation,,,,,,,,,
,Behavioral,6A,Sensation,,,,,,,,,
,Behavioral,6A,Sensation,,,,,,,,,
,Behavioral,6A,Visual,,,,,,,,,
,Behavioral,6A,Visual,,,,,,,,,
,Behavioral,6A,Visual,,,,,,,,,
,Behavioral,6A,Visual,,,,,,,,,
,Behavioral,6A,Visual,,,,,,,,,
,Behavioral,6A,Visual,,,,,,,,,
,Behavioral,6A,Visual,,,,,,,,,
,Behavioral,6A,Visual,,,,,,,,,
,Behavioral,6A,Visual,,,,,,,,,
,Behavioral,6A,Visual,,,,,,,,,
,Behavioral,6A,Visual,,,,,,,,,
,Behavioral,6A,Visual,,,,,,,,,
,Behavioral,6A,Visual,,,,,,,,,
,Behavioral,6A,Visual,,,,,,,,,
,Behavioral,6A,Auditory,,,,,,,,,
,Behavioral,6A,Auditory,,,,,,,,,
,Behavioral,6A,Auditory,,,,,,,,,
,Behavioral,6A,Auditory,,,,,,,,,
,Behavioral,6A,Auditory,,,,,,,,,
,Behavioral,6A,Auditory,,,,,,,,,
,Behavioral,6A,Auditory,,,,,,,,,
,Behavioral,6A,Auditory,,,,,,,,,
,Behavioral,6A,Auditory,,,,,,,,,
,Behavioral,6A,Auditory,,,,,,,,,
,Behavioral,6A,Auditory,,,,,,,,,
,Behavioral,6A,Auditory,,,,,,,,,
,Behavioral,6A,Auditory,,,,,,,,,
,Behavioral,6A,Auditory,,,,,,,,,
,Behavioral,6A,Auditory,,,,,,,,,
,Behavioral,6A,Auditory,,,,,,,,,
,Behavioral,6A,Auditory,,,,,,,,,
,Behavioral,6A,Auditory,,,,,,,,,
,Behavioral,6A,Sensation,,,,,,,,,
,Behavioral,6A,Sensation,,,,,,,,,
,Behavioral,6A,Sensation,,,,,,,,,
,Behavioral,6A,Sensation,,,,,,,,,
,Behavioral,6A,Sensation,,,,,,,,,
,Behavioral,6A,Sensation,,,,,,,,,
,Behavioral,6A,Sensation,,,,,,,,,
,Behavioral,6A,Sensation,,,,,,,,,
,Behavioral,6A,Sensation,,,,,,,,,
,Behavioral,6A,Sensation,,,,,,,,,
,Behavioral,6A,Sensation,,,,,,,,,
,Behavioral,6A,Sensation,,,,,,,,,
,Behavioral,6A,Sensation,,,,,,,,,
,Behavioral,6A,Sensation,,,,,,,,,
,Behavioral,6A,Sensation,,,,,,,,,
,Behavioral,6A,Sensation,,,,,,,,,
,Behavioral,6A,Sensation,,,,,,,,,
,Behavioral,7C,Learning,,,,,,,,,
,Behavioral,7C,Learning,,,,,,,,,
,Behavioral,7C,Learning,,,,,,,,,
,Behavioral,7C,Learning,,,,,,,,,
,Behavioral,7C,Learning,,,,,,,,,
,Behavioral,7C,Learning,,,,,,,,,
,Behavioral,7C,Learning,,,,,,,,,
,Behavioral,7C,Learning,,,,,,,,,
,Behavioral,7C,Learning,,,,,,,,,
,Behavioral,7C,Learning,,,,,,,,,
,Behavioral,7C,Learning,,,,,,,,,
,Behavioral,7C,Learning,,,,,,,,,
,Behavioral,7C,Learning,,,,,,,,,
,Behavioral,6B,Memory,,,,,,,,,
,Behavioral,6B,Memory,,,,,,,,,
,Behavioral,6B,Memory,,,,,,,,,
,Behavioral,6B,Memory,,,,,,,,,
,Behavioral,6B,Memory,,,,,,,,,
,Behavioral,6B,Memory,,,,,,,,,
,Behavioral,6B,Memory,,,,,,,,,
,Behavioral,6B,Memory,,,,,,,,,
,Behavioral,6B,Memory,,,,,,,,,
,Behavioral,6B,Memory,,,,,,,,,
,Behavioral,6B,Memory,,,,,,,,,
