Question ID,Subject Category,Content Category,Concept Category (CC),Question,Correct,Wrong 1,Wrong 2,Wrong 3,Keywords?,,,
B7AP-065,Behavioral,7A,Personality,"Which of the following statements best reflects the central tenet of the biological perspective of personality? 

A) Personality traits are primarily shaped by cultural and social influences.  
B) Behavior is largely influenced by environmental factors and learned experiences.  
C) Genetic expression plays a significant role in determining individual behavior and personality.  
D) Cognitive processes are the main drivers of personality development.",Biological perspective,Cognitive perspective,Behavioral perspective,Psychodynamic perspective,,,,
B7AP-066,Behavioral,7A,Personality,"A patient presents with symptoms including delusions of persecution, auditory hallucinations, and significant impairment in social and occupational functioning. Based on the symptoms described, which of the following best characterizes the disorder the patient is likely experiencing? 

Discuss the key features of this disorder and how they differ from related psychiatric disorders.",Schizophrenia,Bipolar disorder,Major depressive disorder,Generalized anxiety disorder,,,,
B7AP-067,Behavioral,7A,Personality,Which of the following is an example of a positive symptom of schizophrenia?,Positive,Negative,Neutral,Mixed,,,,
B7AP-068,Behavioral,7A,Personality,"A 28-year-old woman visits her primary care physician reporting persistent feelings of sadness, fatigue, and difficulty concentrating over the past six months. She mentions that her symptoms seem to worsen during the winter months when there is less sunlight. Based on her symptoms and the seasonal pattern described, which of the following diagnoses is most likely applicable to her condition?",Major depressive disorders,minor depressive disorders,bipolar disorders,anxiety disorders,,,,
B7AP-069,Behavioral,7A,Personality,"A 34-year-old patient presents to a primary care physician with complaints of persistent low mood, fatigue, and difficulty concentrating. Upon further evaluation, the patient reports that these symptoms have been present for the past 3 years. However, the patient denies experiencing any episodes of major depressive disorder. Based on this information, which of the following diagnoses is most consistent with the patient's symptoms?",Persistent depressive disorder (PDD) is dysthymia for at least 2 years that doesn’t meet criteria for major depressive disorder,Mild but long-term form of depression,Major depressive disorder,Seasonal affective disorder,,,,
B7AP-070,Behavioral,7A,Personality,"A 32-year-old woman presents to her primary care physician with symptoms of persistent sadness, fatigue, and social withdrawal that have developed over the past few months. She reports that her mood tends to improve during the spring and summer months but worsens in the fall and winter. Based on her symptoms and seasonal pattern, which of the following diagnoses is most consistent with her presentation?",Seasonal affective disorder,Major depressive disorder,Bipolar disorder,Generalized anxiety disorder,,,,
B7AP-071,Behavioral,7A,Personality,"A 28-year-old male presents to his psychiatrist with a history of experiencing both elevated mood and depressive episodes over the past several years. He describes periods where he feels overly energetic, sleeps very little, and engages in risky behaviors, followed by times when he feels hopeless, fatigued, and has difficulty concentrating. Which of the following best describes the condition that this patient is experiencing? 

Consider the potential symptoms and patterns of mood fluctuations when formulating your answer.",Bipolar disorder,Major depressive disorder,Generalized anxiety disorder,Schizophrenia,,,,
B7AP-072,Behavioral,7A,Personality,"A 28-year-old female presents to the clinic with a history of mood disturbances. She reports experiencing periods of elevated mood, increased energy, and decreased need for sleep, lasting for at least one week. During these episodes, she engages in impulsive behaviors, such as spending large sums of money and being overly talkative. She also describes experiencing episodes of significant sadness and hopelessness lasting for several days. Based on her symptoms and history, which type of bipolar disorder is most likely to be diagnosed? 

Additionally, what other symptoms may she potentially experience during her manic episodes?",The symptoms of bipolar type I include at least one manic episode that may be preceded or followed by hypomanic or major depressive episodes,and in some cases,"the patient may experience psychosis. 

Choices: bipolar type I",bipolar type II,,,,
B7AP-073,Behavioral,7A,Personality,"A 28-year-old woman presents to her primary care physician with a history of mood fluctuations over the past year. She reports experiencing periods of increased energy, decreased need for sleep, and racing thoughts, which last for several days at a time. These episodes are followed by prolonged periods of low energy, lack of interest in activities she once enjoyed, and significant difficulty concentrating. Based on the symptoms described, which type of bipolar disorder is she most likely experiencing?",Bipolar type II,Bipolar type I,Major depressive disorder,Cyclothymic disorder,,,,
B7AP-074,Behavioral,7A,Personality,"A patient presents to a mental health clinic reporting mood fluctuations over the past two years. The patient describes experiencing numerous periods of elevated mood, increased energy, and decreased need for sleep, interspersed with periods of mild depressive symptoms. However, these depressive episodes have never met the criteria for major depressive disorder. Based on this clinical presentation, which of the following disorders is the patient most likely experiencing? 

A) Major depressive disorder  
B) Cyclothymic disorder  
C) Bipolar I disorder  
D) Dysthymic disorder",The symptoms of cyclothymic disorder include at least two years (or one year in children) of many periods of hypomania or depressive symptoms,"though less severe than major depression. 

A) Cyclothymic disorder",B) Major depressive disorder,C) Borderline personality disorder,,,,
B7AP-075,Behavioral,7A,Personality,"A 28-year-old woman presents to her physician with persistent feelings of anxiety and worry that she finds difficult to control. She reports that her anxiety has been affecting her daily life, including her ability to work and socialize. She often feels restless and has trouble sleeping. Her symptoms have been present for several months. Based on the information provided, which of the following anxiety disorders is she most likely experiencing?",Anxiety disorders,Generalized anxiety disorder,Phobias,Social anxiety disorder,,,,
B7AP-076,Behavioral,7A,Personality,Which of the following best describes the relationship between obsessions and compulsions in obsessive-compulsive disorder (OCD)?,Obsessive-compulsive disorder,Anxiety disorder,Mood disorder,Personality disorder,,,,
B7AP-077,Behavioral,7A,Personality,"A 25-year-old female presents to a mental health clinic with persistent dissatisfaction about her appearance, despite being told by friends and family that she looks fine. She often avoids social situations and is preoccupied with flaws that are not apparent to others. Which disorder is most likely characterized by this unrealistic negative evaluation of one’s appearance?",Body dysmorphic disorder,depression,schizophrenia,anxiety disorder,,,,
B7AP-078,Behavioral,7A,Personality,"A 30-year-old man experiences a traumatic car accident and subsequently struggles with flashbacks, nightmares, and heightened anxiety when reminded of the event. Which mental health condition is most likely characterized by these symptoms?",post traumatic stress disorder,anxiety disorder,major depressive disorder,obsessive-compulsive disorder,,,,
B7AP-079,Behavioral,7A,Personality,Which of the following accurately describes the primary characteristic of dissociative disorders?,Dissociative disorders,Mood disorders,Anxiety disorders,Personality disorders,,,,
B7AP-080,Behavioral,7A,Personality,"A 32-year-old woman presents to a mental health clinic with an inability to remember significant personal information related to her past, particularly details about her childhood and recent events. She reports that this memory loss began after a stressful life event. Based on her symptoms, which of the following best describes her condition? 

Which psychological phenomenon is characterized by an inability to recall past experiences, often triggered by trauma or stress?",A person with dissociative amnesia can’t recall past experiences,retrograde amnesia,anterograde amnesia,transient global amnesia.,,,,
B7AP-081,Behavioral,7A,Personality,"A patient presents to the emergency department after being found wandering several cities away from their home. The individual appears confused and cannot recall their name, address, or any significant personal history. Friends and family report that they have not seen this person for several weeks, and there was no indication of any recent stressors or trauma. Based on this information, which of the following best describes the condition this patient is experiencing? 

A. Major depressive disorder  
B. Dissociative fugue  
C. Generalized anxiety disorder  
D. Post-traumatic stress disorder",Loss of identity and unexpected travel,sudden memory recall and no travel,consistent identity and traveling,temporary identity change and local travel,,,,
B7AP-082,Behavioral,7A,Personality,Which of the following best describes the primary feature of dissociative identity disorder (DID)?,Dissociative identity disorder is characterized by experiencing multiple personalities,post-traumatic stress disorder,schizophrenia,mood swings.,,,,
B7AP-083,Behavioral,7A,Personality,"A 25-year-old woman presents to her therapist with complaints of feeling disconnected from her thoughts and emotions, as well as perceiving her surroundings as unreal or dreamlike. These experiences have been distressing and have persisted for several months. Based on the information provided, which psychological disorder is most consistent with her symptoms? 

Additionally, which of the following factors could potentially contribute to the onset of this disorder?",Someone with depersonalization/derealization disorder experiences a feeling of detachment from the mind and body,the environment,a sense of altered reality,or emotional numbness.,,,,
B7AP-084,Behavioral,7A,Personality,"A 30-year-old woman presents to her primary care physician with multiple complaints of abdominal pain, headaches, and fatigue. After extensive medical testing, no physiological causes for her symptoms are found. Upon further evaluation, it is determined that her symptoms are significantly exacerbated during periods of increased psychological stress. 

Which of the following best describes the nature of her condition?",Somatic symptom disorders,Conversion disorders,Anxiety disorders,Mood disorders,,,,
B7AP-085,Behavioral,7A,Personality,"A 30-year-old woman presents to her primary care physician with complaints of severe fatigue and chronic pain lasting over six months. Despite extensive medical evaluations, no underlying physical cause can be identified for her symptoms. The patient expresses significant worry about her health and often interprets normal bodily sensations as signs of a serious illness. Based on this scenario, what psychological disorder is the patient most likely experiencing?",Somatic symptom disorder,generalized anxiety disorder,major depressive disorder,obsessive-compulsive disorder,,,,
B7AP-086,Behavioral,7A,Personality,A 30-year-old patient presents to their primary care physician expressing persistent concern about experiencing a serious illness despite extensive medical evaluations returning normal results. The patient frequently researches symptoms online and often seeks reassurance from healthcare providers. This behavior is most consistent with which of the following mental health disorders?,Illness anxiety disorder,Somatic symptom disorder,Generalized anxiety disorder,Panic disorder,,,,
B7AP-087,Behavioral,7A,Personality,"A 28-year-old woman presents to the emergency department with sudden onset of weakness in her left arm and leg. Neurological examination reveals no signs of structural brain injury or neurological disease, and her lab tests return normal. The patient reports having experienced significant stress at work due to a recent traumatic event involving the loss of a loved one. Which of the following best describes her condition?",Conversion disorder,somatic symptom disorder,bipolar disorder,anxiety disorder,,,,
B7AP-088,Behavioral,7A,Personality,"A 28-year-old female presents to her therapist with difficulties in her interpersonal relationships, often experiencing intense emotional swings and a distorted self-image. She has a history of unstable relationships and exhibits impulsive behaviors. Based on her symptoms, which type of psychological disorder is she most likely experiencing?",Personality disorders,Anxiety disorders,Mood disorders,Psychotic disorders,,,,
B7AP-089,Behavioral,7A,Personality,"Which cluster of personality disorders is characterized by features such as social awkwardness and social withdrawal, and is often referred to as the ""odd,"" ""eccentric,"" or ""weird"" cluster?",A,B,C,D,,,,
B7AP-090,Behavioral,7A,Personality,"Which cluster of personality disorders is characterized by dramatic, overly emotional, or unpredictable thinking or behavior, often referred to as the ""wild"" cluster?",B,A,C,D,,,,
B7AP-091,Behavioral,7A,Personality,"Which cluster of personality disorders is characterized by feelings of anxiety and fear and is often referred to as the ""worried"" cluster?",C: Avoidant,A: Antisocial,B: Narcissistic,D: Borderline,,,,
B7AP-092,Behavioral,7A,Personality,"Which psychological approach emphasizes the role of environmental factors and observable behaviors in the development and treatment of psychological disorders, and utilizes concepts such as classical and operant conditioning?",Behaviorist approach,Cognitive approach,Humanistic approach,Psychoanalytic approach,,,,
B7AP-093,Behavioral,7A,Personality,Which of the following best describes the primary focus of the biomedical approach to psychological disorders?,The biomedical approach to psychological disorders focuses on physical causes and symptoms,psychological causes and symptoms,social influences on behavior,environmental factors affecting mental health.,,,,
B7AP-094,Behavioral,7A,Personality,Which of the following statements best describes the biopsychosocial approach to understanding psychological disorders?,Biopsychosocial approach,Biological model,Psychological model,Social model,,,,
B7AP-095,Behavioral,7A,Personality,Which of the following statements best describes the psychodynamic approach to psychological disorders as proposed by Freud?,Psychodynamic approach,behavioral approach,cognitive approach,humanistic approach,,,,
B7AP-096,Behavioral,7A,Personality,"Which of the following principles is primarily used in the Diagnostic and Statistical Manual of Mental Disorders, 5th edition (DSM-5) to classify and diagnose mental disorders?",The DSM-5 categorizes mental disorders based on symptoms,diagnosis,treatment,"and prevalence. 

Choices: symptoms",,,,
B7AP-097,Behavioral,7A,Personality,Which of the following biological factors has been associated with an increased risk of developing schizophrenia?,Genetic factors,Birth trauma,Marijuana use,Family history,,,,
B7AP-098,Behavioral,7A,Personality,Which of the following biological factors is associated with an increased risk of developing depression?,High glucocorticoids,Low norepinephrine,Low serotonin,Low dopamine,,,,
B7AP-099,Behavioral,7A,Personality,"Which of the following factors is associated with an increased risk for developing bipolar disorder? 

A) Elevated levels of norepinephrine  
B) Normal serotonin levels  
C) Absence of family history  
D) Decreased dopamine activity",High norepinephrine,Abnormal serotonin,Family history,Low dopamine,,,,
B7AP-100,Behavioral,7A,Personality,Which of the following biological factors is most closely associated with the pathophysiology of Alzheimer’s disease?,Genetic factors,Brain atrophy,Low acetylcholine,Senile plaques of β-amyloid,,,,
B7AP-101,Behavioral,7A,Personality,Which of the following symptoms is most closely associated with the biological factors underlying Parkinson’s disease?,Low dopamine,Bradykinesia,Masklike facies,Shuffling gait,,,,
B7BS-001,Behavioral,7B,Social Processes on Individuals,"A group of students is preparing for their final exams, and they decide to study together in a study room. One student, who typically struggles with math, finds that they can solve problems more quickly and accurately when they are working alongside their peers compared to when they study alone. This phenomenon is best described by which concept in social psychology? 

Please provide an explanation of how this concept relates to the student’s performance in a group setting.",Social facilitation,Social inhibition,Social loafing,Social dominance,,,,
B7BS-002,Behavioral,7B,Social Processes on Individuals,"During a psychological experiment, researchers observe that individuals in a large crowd exhibit behaviors that are more extreme and less restrained compared to when they are alone. This phenomenon is most likely an example of which of the following concepts? 

A. Social facilitation  
B. Group polarization  
C. Deindividuation  
D. Bystander effect",Deindividuation is a loss of self-awareness in large groups,A) Deindividuation,B) Groupthink,C) Social facilitation,,,,
B7BS-003,Behavioral,7B,Social Processes on Individuals,"A group of college students is studying together when one of them suddenly collapses and appears to be in distress. Despite the urgency of the situation, none of the students immediately intervene or seek help. Which psychological phenomenon best explains the behavior of the students in this scenario?",Diffusion of responsibility,Social facilitation,Groupthink,Social loafing,,,,
B7BS-004,Behavioral,7B,Social Processes on Individuals,"Which psychological phenomenon describes the influence exerted by individuals on their peers to conform to group behaviors or attitudes, particularly when the peers are perceived as equals?",{{c1::Peer pressure}},Social conformity,Group dynamics,Social isolation,,,,
B7BS-005,Behavioral,7B,Social Processes on Individuals,"In a group project, a student named Alex notices that he is contributing less effort than he would if he were working alone. He finds himself relying on his peers to complete tasks while he tends to socializing or taking breaks. This phenomenon where Alex does not pull his weight in the group setting exemplifies which of the following concepts in social psychology?",Social loafing,Free riding,Team shirking,Collective inertia,,,,
B7BS-006,Behavioral,7B,Social Processes on Individuals,Which psychological phenomenon is characterized by a group's tendency to make decisions that are more extreme than the initial inclinations of its individual members?,Polarization,Groupthink,Conformity,Individual decision-making,,,,
B7BS-007,Behavioral,7B,Social Processes on Individuals,"A psychologist is studying decision-making processes within groups and finds that members often agree with prevailing opinions or solutions without critically evaluating alternative viewpoints. This phenomenon is most accurately described as:

{{c1::Groupthink}}",Groupthink,Conformity,Individual decision-making,Collective intelligence,,,,
B7BS-001,Behavioral,7B,Social Porcesses on Communities,"Which of the following best describes the components that constitute a culture within a society? 

A) Only the beliefs and ideologies of a group  
B) The shared beliefs, ideas, behaviors, actions, and characteristics of a group  
C) The historical events that have shaped a society's identity  
D) The economic and political systems that govern a society",{{c1::Culture}} is a term used to describe the beliefs,ideas,behaviors,actions,,,,
B7BS-002,Behavioral,7B,Social Porcesses on Communities,"A researcher is studying the integration of immigrant communities into the host culture of a new country. They find that individuals from these communities adopt various customs, languages, and values of the mainstream society while still maintaining certain aspects of their original cultural identities. This phenomenon is indicative of which sociocultural process?

A) Socialization  
B) Assimilation  
C) Acculturation  
D) Integration",Assimilation,Integration,Segregation,Isolation,,,,
B7BS-003,Behavioral,7B,Social Porcesses on Communities,"Which of the following best describes the concept of multiculturalism as it pertains to community dynamics? 

A) The promotion of a single dominant culture over others to ensure social cohesion.  
B) The encouragement of multiple cultures within a community to enhance diversity.  
C) The complete assimilation of minority cultures into the dominant culture to avoid conflict.  
D) The isolation of different cultural groups to preserve their unique traditions and practices.","What is the term for the encouragement of multiple cultures within a community to enhance diversity?

A) Multiculturalism",B) Assimilation,C) Segregation,D) Nationalism,,,,
B7BS-004,Behavioral,7B,Social Porcesses on Communities,Which of the following best describes the concept of a subculture in the context of social interactions and cultural identity?,"A/an subculture is a group of people within a culture that distinguish themselves from the primary culture. 

Choices: subculture",counterculture,mainstream culture,dominant culture,,,,
B6CM-017,Behavioral,6C,Motivation & Attitudes,"Which of the following components of attitude specifically relates to the emotional response an individual has towards an object, person, or situation?",Attitudes,Affective,behavioral,cognitive,,,,
B6CM-018,Behavioral,6C,Motivation & Attitudes,Which psychological theory posits that beliefs and attitudes serve specific functions in influencing behavior and decision-making?,Functional attitudes theory,Cognitive dissonance theory,Social identity theory,Elaboration likelihood model,,,,
B6CM-019,Behavioral,6C,Motivation & Attitudes,"A researcher conducts an experiment to investigate the effects of observational learning on children's behavior. In the study, a group of children observes an adult interacting aggressively with a Bobo doll. Later, the children are given the opportunity to play with the doll themselves. Which of the following concepts best explains the children's behavior in this scenario?",Observational learning theory,Cognitive learning theory,Classical conditioning theory,Operant conditioning theory,,,,
B6CM-020,Behavioral,6C,Motivation & Attitudes,Which of the following best describes the primary distinction between the central route and the peripheral route in the elaboration likelihood model of persuasion?,"The elaboration likelihood model describes how people are persuaded to change their attitudes. 

A) change their attitudes",B) ignore information,C) reinforce their beliefs,D) enhance their skills.,,,,
B6CM-021,Behavioral,6C,Motivation & Attitudes,Which of the following best describes the mechanism by which the social cognitive theory explains the formation of attitudes?,Social cognitive theory,behavioral theory,reinforcement theory,observational learning theory,,,,
B7BS-005,Behavioral,7B,Social Porcesses on Communities,Which of the following best describes the primary purpose of socialization in individuals within a society?,{{c1::Socialization}},Acculturation,Assimilation,Segregation,,,,
B7BS-006,Behavioral,7B,Social Porcesses on Communities,Which of the following best describes the role of sanctions in the context of social norms?,Sanctions,rewards,negotiations,discussions,,,,
B7BS-007,Behavioral,7B,Social Porcesses on Communities,Which of the following best describes the role of positive sanctions in behavior modification according to social learning theory?,Reward,Punishment,Disciplinary action,Consequence,,,,
B7BS-008,Behavioral,7B,Social Porcesses on Communities,"A sociologist is conducting a study on the impact of social norms on individual behavior. During observations, they note that individuals in a community often respond negatively to those who violate social expectations, such as dress code or etiquette, without any formal punishment being enacted by authorities. This reaction represents which type of sanction? 

Which of the following best describes this type of sanction?",A/an informal sanction is not enforced or punished by an authority but occurs in everyday interactions with other people,A formal sanction,A legal sanction,A punitive sanction,,,,
B7BS-009,Behavioral,7B,Social Porcesses on Communities,Which of the following best describes the role of norms in a society?,Norms,Rules,Customs,Laws,,,,
B7BS-010,Behavioral,7B,Social Porcesses on Communities,Which of the following statements best describes the distinction between mores and folkways in the context of social norms?,Mores,Folkways,Laws,Customs,,,,
B7BS-011,Behavioral,7B,Social Porcesses on Communities,"Which of the following best describes the difference between folkways and mores in the context of social norms? 

1. Folkways are formal laws that govern behavior, while mores are informal guidelines.
2. Mores are less significant and focus on what is considered right versus rude, whereas folkways deal with right versus wrong.
3. Folkways are informal norms that govern everyday behavior, while mores are serious norms that dictate moral and ethical behavior.
4. Mores are customs that arise from cultural traditions, while folkways are universally accepted rules across societies.",Folkways,Mores,Social Norms,Taboos,,,,
